{
  "$schema": "https://flower.dev/schemas/module/v1.json",
  "schemaVersion": 1,
  "id": "organizations",
  "version": "1.0.0",
  "compatibleFlower": ">=0.1.0 <0.2.0",
  "dependsOn": { "auth": "^1.0.0" },
  "conflictsWith": [],
  "provides": ["organization-membership"],
  "configurationSchema": "./schemas/config.json",
  "migrations": [],
  "generatedPaths": ["src/flower/organizations.ts"],
  "requiredChecks": ["organizations-contract"]
}
