{
  "$schema": "https://flower.dev/schemas/module/v1.json",
  "schemaVersion": 1,
  "id": "rbac",
  "version": "1.0.0",
  "compatibleFlower": ">=0.1.0 <0.2.0",
  "dependsOn": { "organizations": "^1.0.0" },
  "conflictsWith": [],
  "provides": ["authorization", "permission", "role"],
  "configurationSchema": "./schemas/config.json",
  "migrations": [],
  "generatedPaths": ["src/flower/rbac.ts"],
  "requiredChecks": ["rbac-contract"]
}
