{
  "$schema": "https://flower.dev/schemas/module/v1.json",
  "schemaVersion": 1,
  "id": "audit",
  "version": "1.0.0",
  "compatibleFlower": ">=0.1.0 <0.2.0",
  "dependsOn": { "organizations": "^1.0.0" },
  "conflictsWith": [],
  "provides": ["audit-event", "audit-trail"],
  "configurationSchema": "./schemas/config.json",
  "migrations": ["audit-001"],
  "generatedPaths": ["src/flower/audit.ts"],
  "requiredChecks": ["audit-contract"]
}
